{
  "schemaVersion": 1,
  "venueTemplates": [
    {
      "schemaVersion": 1,
      "kind": "venue-template",
      "id": "venue-template-harborview",
      "version": "1.0.0",
      "name": "Harborview Convention Center",
      "roomTemplateIds": [
        "room-template-harborview-main-hall"
      ]
    },
    {
      "schemaVersion": 1,
      "kind": "venue-template",
      "id": "venue-template-conference-starter",
      "version": "1.0.0",
      "name": "conference starter venue",
      "roomTemplateIds": [
        "room-template-conference"
      ]
    },
    {
      "schemaVersion": 1,
      "kind": "venue-template",
      "id": "venue-template-concert-starter",
      "version": "1.0.0",
      "name": "concert starter venue",
      "roomTemplateIds": [
        "room-template-concert"
      ]
    },
    {
      "schemaVersion": 1,
      "kind": "venue-template",
      "id": "venue-template-banquet-starter",
      "version": "1.0.0",
      "name": "banquet starter venue",
      "roomTemplateIds": [
        "room-template-banquet"
      ]
    },
    {
      "schemaVersion": 1,
      "kind": "venue-template",
      "id": "venue-template-exhibition-starter",
      "version": "1.0.0",
      "name": "exhibition starter venue",
      "roomTemplateIds": [
        "room-template-exhibition"
      ]
    },
    {
      "schemaVersion": 1,
      "kind": "venue-template",
      "id": "venue-template-classroom-starter",
      "version": "1.0.0",
      "name": "classroom starter venue",
      "roomTemplateIds": [
        "room-template-classroom"
      ]
    },
    {
      "schemaVersion": 1,
      "kind": "venue-template",
      "id": "venue-template-community-event-starter",
      "version": "1.0.0",
      "name": "community event starter venue",
      "roomTemplateIds": [
        "room-template-community-event"
      ]
    }
  ],
  "roomTemplates": [
    {
      "schemaVersion": 1,
      "kind": "room-template",
      "id": "room-template-harborview-main-hall",
      "version": "1.0.0",
      "name": "Harborview Main Hall",
      "useCase": "conference",
      "unit": "m",
      "boundary": {
        "outer": [
          {
            "x": 0,
            "y": 0
          },
          {
            "x": 30,
            "y": 0
          },
          {
            "x": 30,
            "y": 20
          },
          {
            "x": 0,
            "y": 20
          }
        ],
        "holes": []
      },
      "capacity": 450,
      "objects": [
        {
          "id": "roomobj-fire-exit-east",
          "kind": "fire_exit",
          "label": "East fire exit",
          "layer": "safety",
          "elevationM": 0,
          "footprint": {
            "kind": "line",
            "start": {
              "x": 29.9,
              "y": 8.5
            },
            "end": {
              "x": 29.9,
              "y": 11.5
            },
            "width": 0.2
          },
          "exit": {
            "clearWidthM": 3,
            "emergency": true,
            "capacityPersons": 450
          }
        },
        {
          "id": "roomobj-column-southwest",
          "kind": "column",
          "label": "Southwest column",
          "layer": "architecture",
          "elevationM": 4.5,
          "footprint": {
            "kind": "circle",
            "center": {
              "x": 8,
              "y": 4
            },
            "radius": 0.45
          }
        },
        {
          "id": "roomobj-power-west",
          "kind": "utility_point",
          "label": "West power",
          "layer": "architecture",
          "elevationM": 0,
          "footprint": {
            "kind": "rectangle",
            "center": {
              "x": 2,
              "y": 3
            },
            "width": 0.3,
            "depth": 0.3,
            "rotationDegrees": 0
          },
          "utility": {
            "type": "power",
            "circuitId": "circuit-west-63a",
            "rating": "63A",
            "voltage": 230,
            "maxWatts": 43600,
            "powerKw": 43.6
          }
        },
        {
          "id": "roomobj-rigging-center",
          "kind": "rigging_point",
          "label": "Center rigging",
          "layer": "production",
          "elevationM": 8,
          "footprint": {
            "kind": "circle",
            "center": {
              "x": 15,
              "y": 10
            },
            "radius": 0.15
          },
          "rigging": {
            "safeWorkingLoadKg": 1000
          }
        },
        {
          "id": "roomobj-production-zone",
          "kind": "restricted_zone",
          "label": "Production clearance",
          "layer": "safety",
          "elevationM": 0,
          "footprint": {
            "kind": "rectangle",
            "center": {
              "x": 4,
              "y": 18
            },
            "width": 6,
            "depth": 2,
            "rotationDegrees": 0
          },
          "restriction": {
            "access": "staff-only",
            "reasonCode": "production-clearance",
            "blocksPlacement": true
          }
        },
        {
          "id": "roomobj-main-route",
          "kind": "corridor",
          "label": "Main access spine",
          "layer": "access",
          "elevationM": 0,
          "footprint": {
            "kind": "line",
            "start": {
              "x": 15,
              "y": 0.5
            },
            "end": {
              "x": 15,
              "y": 10
            },
            "width": 1.219
          },
          "route": {
            "direction": "bidirectional",
            "accessible": true,
            "purpose": "primary-access"
          }
        }
      ]
    },
    {
      "schemaVersion": 1,
      "kind": "room-template",
      "id": "room-template-harborview-main-hall",
      "version": "1.1.0",
      "name": "Harborview Main Hall",
      "useCase": "conference",
      "unit": "m",
      "boundary": {
        "outer": [
          {
            "x": 0,
            "y": 0
          },
          {
            "x": 30,
            "y": 0
          },
          {
            "x": 30,
            "y": 20
          },
          {
            "x": 0,
            "y": 20
          }
        ],
        "holes": []
      },
      "capacity": 450,
      "objects": [
        {
          "id": "roomobj-fire-exit-east",
          "kind": "fire_exit",
          "label": "East fire exit",
          "layer": "safety",
          "elevationM": 0,
          "footprint": {
            "kind": "line",
            "start": {
              "x": 29.9,
              "y": 8.5
            },
            "end": {
              "x": 29.9,
              "y": 11.5
            },
            "width": 0.2
          },
          "exit": {
            "clearWidthM": 3,
            "emergency": true,
            "capacityPersons": 450
          }
        },
        {
          "id": "roomobj-column-southwest",
          "kind": "column",
          "label": "Southwest column",
          "layer": "architecture",
          "elevationM": 4.5,
          "footprint": {
            "kind": "circle",
            "center": {
              "x": 8,
              "y": 4
            },
            "radius": 0.45
          }
        },
        {
          "id": "roomobj-power-west",
          "kind": "utility_point",
          "label": "West power",
          "layer": "architecture",
          "elevationM": 0,
          "footprint": {
            "kind": "rectangle",
            "center": {
              "x": 2,
              "y": 3
            },
            "width": 0.3,
            "depth": 0.3,
            "rotationDegrees": 0
          },
          "utility": {
            "type": "power",
            "circuitId": "circuit-west-63a",
            "rating": "63A",
            "voltage": 230,
            "maxWatts": 43600,
            "powerKw": 43.6
          }
        },
        {
          "id": "roomobj-rigging-center",
          "kind": "rigging_point",
          "label": "Center rigging",
          "layer": "production",
          "elevationM": 8,
          "footprint": {
            "kind": "circle",
            "center": {
              "x": 15,
              "y": 10
            },
            "radius": 0.15
          },
          "rigging": {
            "safeWorkingLoadKg": 1000
          }
        },
        {
          "id": "roomobj-production-zone",
          "kind": "restricted_zone",
          "label": "Production clearance",
          "layer": "safety",
          "elevationM": 0,
          "footprint": {
            "kind": "rectangle",
            "center": {
              "x": 4,
              "y": 18
            },
            "width": 6,
            "depth": 2,
            "rotationDegrees": 0
          },
          "restriction": {
            "access": "staff-only",
            "reasonCode": "production-clearance",
            "blocksPlacement": true
          }
        },
        {
          "id": "roomobj-main-route",
          "kind": "corridor",
          "label": "Main access spine",
          "layer": "access",
          "elevationM": 0,
          "footprint": {
            "kind": "line",
            "start": {
              "x": 15,
              "y": 0.5
            },
            "end": {
              "x": 15,
              "y": 10
            },
            "width": 1.829
          },
          "route": {
            "direction": "bidirectional",
            "accessible": true,
            "purpose": "primary-access"
          }
        }
      ]
    },
    {
      "schemaVersion": 1,
      "kind": "room-template",
      "id": "room-template-conference",
      "version": "1.0.0",
      "name": "Conference hall",
      "useCase": "conference",
      "unit": "m",
      "boundary": {
        "outer": [
          {
            "x": 0,
            "y": 0
          },
          {
            "x": 24,
            "y": 0
          },
          {
            "x": 24,